{
  "schemaVersion": 1,
  "revision": "local-fixture-04c",
  "publishedAt": "2026-10-27T00:00:00Z",
  "games": [
    {
      "id": "bloodborne",
      "collectionId": "bloodborne",
      "status": "published",
      "title": "Bloodborne",
      "description": "Hunt through Yharnam. An independent bbport/shadPS4-derived runtime executes game x86-64 code and translates graphics to Vulkan. This is not an official PC release.",
      "genres": ["Action RPG"],
      "tags": ["FromSoftware", "Yharnam", "hunt"],
      "sourceConsole": "PlayStation 4",
      "implementation": "compatibility-runtime",
      "media": {
        "gallery": []
      },
      "requirements": {
        "os": "Windows 10 1903+ / 11 x64",
        "cpu": "Intel Core 4th gen+ / AMD Ryzen; AVX",
        "gpu": "Vulkan 1.3; current driver",
        "memory": "~6 GB free RAM + pagefile; ~10 GB at 1440p/4K",
        "storage": "Own game data and runtime",
        "notes": "Pinned SuperMedo README, 2026-10-27; not PORT measurements."
      },
      "compatibility": {
        "status": "playable",
        "notes": "User confirmed CUSA03173 1.09 launches and works. Performance depends on hardware."
      },
      "project": {
        "github": "https://github.com/Supermedo/bloodborne_pc",
        "authors": ["SuperMedo / Mohammed Albarghouthi"],
        "license": "GPL-2.0-or-later; component notices apply"
      },
      "requiredFiles": [
        "Own compatible base CUSA03173 PKG or prepared folder",
        "Confirmed cumulative 01.09 PKG; base then update in two steps"
      ],
      "windowsBuild": "available",
      "adapterId": "bloodborne"
    }
  ]
}
